{
  "schema_version": "1.0",
  "lesson_id": "e1-s1-prior-minor",
  "title": "Prior Minor",
  "language": "en",
  "segments": [
    {
      "id": "seg-0001",
      "speaker": "nadia",
      "role": "explanation",
      "source_refs": [
        "block-001"
      ],
      "display_text": "A cache stores reusable work.",
      "spoken_text": "A cache stores reusable work.",
      "style": "calm_explanatory",
      "pause_after_ms": 75,
      "review_status": "approved"
    },
    {
      "id": "seg-0002",
      "speaker": "tom",
      "role": "recap",
      "source_refs": [
        "block-002"
      ],
      "display_text": "A cache hit avoids repeated synthesis.",
      "spoken_text": "A cache hit avoids repeated synthesis.",
      "style": "calm_explanatory",
      "pause_after_ms": 125,
      "review_status": "approved"
    }
  ]
}
